{
  "schemaVersion": "trama.effective-component-evidence/v1",
  "governedRegistryRef": "governance/ui-development/trama-component-evidence-registry-v1.json",
  "liveObservedAt": null,
  "liveObservationStatus": "GOVERNED_ONLY",
  "promotionRequired": false,
  "humanReviewRequired": false,
  "components": [
    {
      "componentId": "ARENA.DIALOG_CONFIRM.LEGACY",
      "product": "ARENA",
      "target": "src/components/ui/ConfirmDialog.tsx",
      "semanticPattern": null,
      "lifecycle": "LEGACY",
      "sourceClass": "PRODUCT_OWNED",
      "relatedFindings": [
        "INV02-F01",
        "INV03-F01"
      ],
      "maturity": {
        "model": "TRAMA_COMPONENT_MATURITY_V1",
        "confirmedStage": "REGISTERED",
        "candidateStage": "BEHAVIOURAL",
        "qualificationStatus": "PARTIAL",
        "remainingEvidenceTypes": [
          "ISOLATED",
          "BEHAVIOURAL",
          "RESPONSIVE_VISUAL",
          "ACCESSIBILITY"
        ]
      },
      "evidenceStatus": {
        "ISOLATED": {
          "type": "ISOLATED",
          "status": "PARTIAL",
          "ref": "docs/inventory/trama-component-evidence-coverage-inv03.md"
        },
        "BEHAVIOURAL": {
          "type": "BEHAVIOURAL",
          "status": "PARTIAL",
          "ref": "docs/inventory/trama-interaction-duplication-inv02.md"
        },
        "RESPONSIVE_VISUAL": {
          "type": "RESPONSIVE_VISUAL",
          "status": "NOT_OBSERVED"
        },
        "ACCESSIBILITY": {
          "type": "ACCESSIBILITY",
          "status": "PARTIAL",
          "ref": "docs/inventory/trama-interaction-duplication-inv02.md"
        }
      },
      "sourceRef": "governance/ui-development/trama-component-evidence-registry-v1.json",
      "governedEvidenceStatus": {
        "ISOLATED": {
          "type": "ISOLATED",
          "status": "PARTIAL",
          "ref": "docs/inventory/trama-component-evidence-coverage-inv03.md"
        },
        "BEHAVIOURAL": {
          "type": "BEHAVIOURAL",
          "status": "PARTIAL",
          "ref": "docs/inventory/trama-interaction-duplication-inv02.md"
        },
        "RESPONSIVE_VISUAL": {
          "type": "RESPONSIVE_VISUAL",
          "status": "NOT_OBSERVED"
        },
        "ACCESSIBILITY": {
          "type": "ACCESSIBILITY",
          "status": "PARTIAL",
          "ref": "docs/inventory/trama-interaction-duplication-inv02.md"
        }
      },
      "observedMaturity": {
        "model": "TRAMA_COMPONENT_MATURITY_V1",
        "confirmedStage": "REGISTERED",
        "candidateStage": "BEHAVIOURAL",
        "qualificationStatus": "PARTIAL",
        "remainingEvidenceTypes": [
          "ISOLATED",
          "BEHAVIOURAL",
          "RESPONSIVE_VISUAL",
          "ACCESSIBILITY"
        ]
      },
      "liveEvidenceRefs": []
    },
    {
      "componentId": "ARENA.DIALOG_CONFIRM.GOVERNED",
      "product": "ARENA",
      "target": "src/ui/components/UiConfirmDialog.tsx",
      "semanticPattern": null,
      "lifecycle": "TRIAL",
      "sourceClass": "PRODUCT_OWNED",
      "relatedFindings": [
        "INV02-F01",
        "INV03-F01"
      ],
      "maturity": {
        "model": "TRAMA_COMPONENT_MATURITY_V1",
        "confirmedStage": "ACCESSIBILITY",
        "candidateStage": "ACCESSIBILITY",
        "qualificationStatus": "QUALIFIED",
        "remainingEvidenceTypes": []
      },
      "evidenceStatus": {
        "ISOLATED": {
          "type": "ISOLATED",
          "status": "PRESENT",
          "ref": "src/ui/stories/UiConfirmDialog.stories.tsx",
          "exactHead": "6a04455139a9a2161c723fdcef5358161aff66c4",
          "runId": "36656179036",
          "repository": "antoniocorsano-boop/CurManLight_arena",
          "artifactId": "11073056182",
          "artifactDigest": "sha256:ce1e0bdcc4bd97dd45a522bdb06cddb416316e23f8d80a8a5bb6a7d2b82bd3fb"
        },
        "BEHAVIOURAL": {
          "type": "BEHAVIOURAL",
          "status": "PRESENT",
          "ref": "src/__tests__/trama-component-evidence-arena-01.test.tsx",
          "exactHead": "6a04455139a9a2161c723fdcef5358161aff66c4",
          "runId": "36656178967",
          "repository": "antoniocorsano-boop/CurManLight_arena"
        },
        "RESPONSIVE_VISUAL": {
          "type": "RESPONSIVE_VISUAL",
          "status": "PRESENT",
          "ref": "scripts/capture-trama-component-evidence.mjs",
          "exactHead": "6a04455139a9a2161c723fdcef5358161aff66c4",
          "runId": "36656179036",
          "repository": "antoniocorsano-boop/CurManLight_arena",
          "artifactId": "11073056182",
          "artifactDigest": "sha256:ce1e0bdcc4bd97dd45a522bdb06cddb416316e23f8d80a8a5bb6a7d2b82bd3fb"
        },
        "ACCESSIBILITY": {
          "type": "ACCESSIBILITY",
          "status": "PRESENT",
          "ref": "src/ui/stories/UiConfirmDialog.stories.tsx",
          "exactHead": "6a04455139a9a2161c723fdcef5358161aff66c4",
          "runId": "36656179036",
          "repository": "antoniocorsano-boop/CurManLight_arena",
          "artifactId": "11073056182",
          "artifactDigest": "sha256:ce1e0bdcc4bd97dd45a522bdb06cddb416316e23f8d80a8a5bb6a7d2b82bd3fb"
        }
      },
      "sourceRef": "governance/ui-development/trama-component-evidence-registry-v1.json",
      "governedEvidenceStatus": {
        "ISOLATED": {
          "type": "ISOLATED",
          "status": "PRESENT",
          "ref": "src/ui/stories/UiConfirmDialog.stories.tsx",
          "exactHead": "6a04455139a9a2161c723fdcef5358161aff66c4",
          "runId": "36656179036",
          "repository": "antoniocorsano-boop/CurManLight_arena",
          "artifactId": "11073056182",
          "artifactDigest": "sha256:ce1e0bdcc4bd97dd45a522bdb06cddb416316e23f8d80a8a5bb6a7d2b82bd3fb"
        },
        "BEHAVIOURAL": {
          "type": "BEHAVIOURAL",
          "status": "PRESENT",
          "ref": "src/__tests__/trama-component-evidence-arena-01.test.tsx",
          "exactHead": "6a04455139a9a2161c723fdcef5358161aff66c4",
          "runId": "36656178967",
          "repository": "antoniocorsano-boop/CurManLight_arena"
        },
        "RESPONSIVE_VISUAL": {
          "type": "RESPONSIVE_VISUAL",
          "status": "PRESENT",
          "ref": "scripts/capture-trama-component-evidence.mjs",
          "exactHead": "6a04455139a9a2161c723fdcef5358161aff66c4",
          "runId": "36656179036",
          "repository": "antoniocorsano-boop/CurManLight_arena",
          "artifactId": "11073056182",
          "artifactDigest": "sha256:ce1e0bdcc4bd97dd45a522bdb06cddb416316e23f8d80a8a5bb6a7d2b82bd3fb"
        },
        "ACCESSIBILITY": {
          "type": "ACCESSIBILITY",
          "status": "PRESENT",
          "ref": "src/ui/stories/UiConfirmDialog.stories.tsx",
          "exactHead": "6a04455139a9a2161c723fdcef5358161aff66c4",
          "runId": "36656179036",
          "repository": "antoniocorsano-boop/CurManLight_arena",
          "artifactId": "11073056182",
          "artifactDigest": "sha256:ce1e0bdcc4bd97dd45a522bdb06cddb416316e23f8d80a8a5bb6a7d2b82bd3fb"
        }
      },
      "observedMaturity": {
        "model": "TRAMA_COMPONENT_MATURITY_V1",
        "confirmedStage": "ACCESSIBILITY",
        "candidateStage": "ACCESSIBILITY",
        "qualificationStatus": "QUALIFIED",
        "remainingEvidenceTypes": []
      },
      "liveEvidenceRefs": []
    },
    {
      "componentId": "ARENA.TABS.LEGACY",
      "product": "ARENA",
      "target": "src/components/ui/Tabs.tsx",
      "semanticPattern": null,
      "lifecycle": "LEGACY",
      "sourceClass": "PRODUCT_OWNED",
      "relatedFindings": [
        "INV02-F02",
        "INV03-F01"
      ],
      "maturity": {
        "model": "TRAMA_COMPONENT_MATURITY_V1",
        "confirmedStage": "REGISTERED",
        "candidateStage": "BEHAVIOURAL",
        "qualificationStatus": "PARTIAL",
        "remainingEvidenceTypes": [
          "ISOLATED",
          "BEHAVIOURAL",
          "RESPONSIVE_VISUAL",
          "ACCESSIBILITY"
        ]
      },
      "evidenceStatus": {
        "ISOLATED": {
          "type": "ISOLATED",
          "status": "PARTIAL",
          "ref": "docs/inventory/trama-component-evidence-coverage-inv03.md"
        },
        "BEHAVIOURAL": {
          "type": "BEHAVIOURAL",
          "status": "PARTIAL",
          "ref": "docs/inventory/trama-interaction-duplication-inv02.md"
        },
        "RESPONSIVE_VISUAL": {
          "type": "RESPONSIVE_VISUAL",
          "status": "NOT_OBSERVED"
        },
        "ACCESSIBILITY": {
          "type": "ACCESSIBILITY",
          "status": "PARTIAL",
          "ref": "docs/inventory/trama-interaction-duplication-inv02.md"
        }
      },
      "sourceRef": "governance/ui-development/trama-component-evidence-registry-v1.json",
      "governedEvidenceStatus": {
        "ISOLATED": {
          "type": "ISOLATED",
          "status": "PARTIAL",
          "ref": "docs/inventory/trama-component-evidence-coverage-inv03.md"
        },
        "BEHAVIOURAL": {
          "type": "BEHAVIOURAL",
          "status": "PARTIAL",
          "ref": "docs/inventory/trama-interaction-duplication-inv02.md"
        },
        "RESPONSIVE_VISUAL": {
          "type": "RESPONSIVE_VISUAL",
          "status": "NOT_OBSERVED"
        },
        "ACCESSIBILITY": {
          "type": "ACCESSIBILITY",
          "status": "PARTIAL",
          "ref": "docs/inventory/trama-interaction-duplication-inv02.md"
        }
      },
      "observedMaturity": {
        "model": "TRAMA_COMPONENT_MATURITY_V1",
        "confirmedStage": "REGISTERED",
        "candidateStage": "BEHAVIOURAL",
        "qualificationStatus": "PARTIAL",
        "remainingEvidenceTypes": [
          "ISOLATED",
          "BEHAVIOURAL",
          "RESPONSIVE_VISUAL",
          "ACCESSIBILITY"
        ]
      },
      "liveEvidenceRefs": []
    },
    {
      "componentId": "ARENA.TABS.GOVERNED",
      "product": "ARENA",
      "target": "src/ui/components/UiTabs.tsx",
      "semanticPattern": null,